{
  "$schema": "https://json-schema.org/draft/2020-12/schema",
  "$id": "https://eidovela.axisrobo.io/conformance/fixture.schema.json",
  "title": "EidovelaConformanceFixture",
  "description": "An executable conformance scenario for EIDOVELA. The runner drives a live eidovelad over HTTP, generates real PoP keys and (for spiffe/mtls) self-signed certificates or (for k8s) claim-correct tokens, executes the ordered steps in a fresh tenant, and asserts the scenario expectation.",
  "type": "object",
  "required": ["id", "threat_ref", "expectation", "scenario"],
  "properties": {
    "id": { "type": "string", "pattern": "^(P|N)-T[1-8]-[0-9]+$|^(P|N)-G[0-6]-[0-9]+$|^(P|N)-F[1-9]-[0-9]+$|^(P|N)-I[0-9]-[0-9]+$|^(P|N)-O[0-9]-[0-9]+$|^(P|N)-B[0-9]-[0-9]+$|^(P|N)-BR-[0-9]+$" },
    "description": { "type": "string" },
    "threat_ref": { "type": "string" },
    "expectation": { "type": "string", "enum": ["allow", "deny"] },
    "deny_reason": { "type": "string" },
    "scenario": {
      "type": "object",
      "required": ["agent_class", "binding_type", "authority_root_ref", "steps"],
      "properties": {
        "agent_class": { "type": "string", "enum": ["twin", "service", "ephemeral"] },
        "binding_type": { "type": "string", "enum": ["human_master", "organization_root"] },
        "authority_root_ref": { "type": "string" },
        "steps": {
          "type": "array",
          "minItems": 1,
          "items": { "$ref": "#/$defs/step" }
        }
      },
      "additionalProperties": false
    }
  },
  "additionalProperties": false,
  "$defs": {
    "step": {
      "type": "object",
      "required": ["op"],
      "properties": {
        "op": { "type": "string", "enum": ["register_workload", "complete_enrollment", "activate", "suspend", "revoke", "suspend_identity", "issue_token", "introspect", "exchange", "register_federation_trust", "disable_federation_trust", "issue_peer_token", "broker_issue", "instance_lease", "instance_terminate", "list_agents", "agent_detail", "evidence_events", "evidence_since", "outbox_status", "outbox_events", "instances_lease_projection"] },
        "workload_attributes": {
          "type": "object",
          "description": "Caller-supplied attributes for a private_key_jwt enrollment; must satisfy the workload selector.",
          "additionalProperties": { "type": "string" }
        },
        "workload": {
          "type": "object",
          "properties": {
            "platform": { "type": "string", "enum": ["kubernetes", "spiffe", "mtls", "vm", "device"] },
            "selector": { "type": "object", "additionalProperties": { "type": "string" } },
            "trust_domain": { "type": "string" },
            "allowed_proof_methods": { "type": "array", "items": { "type": "string" }, "minItems": 1 }
          },
          "required": ["platform", "selector", "trust_domain", "allowed_proof_methods"],
          "additionalProperties": false
        },
        "attestation": {
          "type": "object",
          "description": "Attestation evidence the runner must synthesize.",
          "properties": {
            "method": { "type": "string", "enum": ["private_key_jwt", "spiffe_svid", "k8s_projected_sa", "mtls"] },
            "spiffe_id": { "type": "string", "description": "spiffe://<trust>/<path> URI SAN to place in the generated SVID" },
            "subject_cn": { "type": "string", "description": "mTLS certificate CN to generate" },
            "dns_names": { "type": "array", "items": { "type": "string" } },
            "kubernetes_issuer": { "type": "string", "description": "iss claim of the generated projected-ServiceAccount token" },
            "kubernetes_subject": { "type": "string", "description": "sub claim, system:serviceaccount:<ns>:<name>" }
          },
          "required": ["method"],
          "additionalProperties": false
        },
        "audience": { "type": "string" },
        "requested_audience": { "type": "string" },
        "present_key": { "type": "string", "description": "Which PoP key to present: main (default) or attacker" },
        "federation": {
          "type": "object",
          "description": "Peer trust configuration for register_federation_trust. jwks_uri is injected by the runner.",
          "properties": {
            "issuer": { "type": "string" },
            "allowed_audiences": { "type": "array", "items": { "type": "string" }, "minItems": 1 },
            "claim_mappings": { "type": "object", "additionalProperties": { "type": "string" } },
            "status": { "type": "string", "enum": ["active", "disabled"] }
          },
          "required": ["allowed_audiences"],
          "additionalProperties": false
        },
        "federation_issuer": { "type": "string", "description": "Issuer for disable_federation_trust or to sign under for issue_peer_token (default https://peer.example.test)" },
        "peer_agent": { "type": "string", "description": "sub claim for the peer-signed token (default agt_peer)" },
        "expired": { "type": "boolean", "description": "Sign the peer token with an already-elapsed exp (default false)" },
        "reason": { "type": "string", "description": "Operator reason recorded on a suspend/revoke lifecycle event" },
        "blueprint_version": { "type": "string", "description": "Version for blueprint_register" },
        "blueprint_publisher": { "type": "string", "description": "Publisher for blueprint_register (default axisrobo)" },
        "blueprint_class": { "type": "string", "description": "Declared class for blueprint_register (twin|service|ephemeral)" },
        "expect_blueprint_status": { "type": "string", "description": "Status blueprint_list must observe for the managed blueprint version (draft|published|deprecated)" },
        "expect": { "type": "string", "enum": ["ok", "deny"] },
        "deny_reason": { "type": "string" }
      },
      "additionalProperties": false
    }
  }
}
