{
  "id": "P-O1-1",
  "description": "Read projections expose the registered agent, its registration evidence, and outbox health",
  "threat_ref": "O1",
  "expectation": "allow",
  "scenario": {
    "agent_class": "service",
    "binding_type": "organization_root",
    "authority_root_ref": "org:projection",
    "steps": [
      {
        "op": "register_workload",
        "workload": {
          "platform": "kubernetes",
          "selector": { "namespace": "prod", "serviceaccount": "agent" },
          "trust_domain": "example.test",
          "allowed_proof_methods": ["private_key_jwt"]
        }
      },
      { "op": "complete_enrollment", "attestation": { "method": "private_key_jwt" }, "workload_attributes": { "namespace": "prod", "serviceaccount": "agent" } },
      { "op": "list_agents", "expect": "ok" },
      { "op": "evidence_events", "expect": "ok" },
      { "op": "outbox_status", "expect": "ok" }
    ]
  }
}
