{
  "id": "P-F1-1",
  "description": "A token signed by an active, trusted peer issuer introspects active",
  "threat_ref": "F1",
  "expectation": "allow",
  "scenario": {
    "agent_class": "service",
    "binding_type": "organization_root",
    "authority_root_ref": "org:peer-console",
    "steps": [
      {
        "op": "register_federation_trust",
        "federation": {
          "issuer": "https://peer.example.test",
          "allowed_audiences": ["aegivela"],
          "claim_mappings": { "agentId": "sub" },
          "status": "active"
        }
      },
      { "op": "issue_peer_token", "audience": "aegivela", "federation_issuer": "https://peer.example.test" },
      { "op": "introspect", "audience": "aegivela", "present_key": "main", "expect": "ok" }
    ]
  }
}
