{
  "id": "P-O5-1",
  "description": "Instance projection preserves stored fields and reports a valid lease without lease_expired",
  "threat_ref": "O5",
  "expectation": "allow",
  "scenario": {
    "agent_class": "twin",
    "binding_type": "human_master",
    "authority_root_ref": "user:alice@example.test",
    "steps": [
      {
        "op": "register_workload",
        "workload": {
          "platform": "kubernetes",
          "selector": { "namespace": "prod", "serviceaccount": "agent" },
          "trust_domain": "example.test",
          "allowed_proof_methods": ["private_key_jwt"]
        }
      },
      { "op": "complete_enrollment", "attestation": { "method": "private_key_jwt" }, "workload_attributes": { "namespace": "prod", "serviceaccount": "agent" } },
      { "op": "activate" },
      { "op": "instance_lease", "expect": "ok" },
      { "op": "instances_lease_projection", "expect": "ok" }
    ]
  }
}
